{
  "$schema": "https://json-schema.org/draft/2020-12/schema",
  "$id": "request.schema.json",
  "title": "Запрос к модели",
  "type": "object",
  "additionalProperties": false,
  "required": [
    "request_id",
    "persona_id",
    "session_id",
    "state_version",
    "issued_at",
    "life_time_ms",
    "purpose",
    "context",
    "allowed_proposals",
    "allowed_actions",
    "limits",
    "response_schema",
    "idempotency_key"
  ],
  "properties": {
    "request_id": {
      "type": "string",
      "pattern": "^req_[A-Za-z0-9]{8,40}$"
    },
    "persona_id": {
      "type": "string",
      "pattern": "^(per|exp)_[A-Za-z0-9]{8,40}$"
    },
    "session_id": {
      "type": "string",
      "pattern": "^ses_[A-Za-z0-9]{8,40}$"
    },
    "state_version": {
      "type": "integer",
      "minimum": 0
    },
    "issued_at": {
      "type": "string",
      "pattern": "^\\d{4}-\\d{2}-\\d{2}T\\d{2}:\\d{2}:\\d{2}(\\.\\d{1,6})?Z$"
    },
    "life_time_ms": {
      "type": "integer",
      "minimum": 0
    },
    "purpose": {
      "enum": [
        "appraise",
        "choose_action",
        "compose_message",
        "reflect",
        "summarize",
        "generalize"
      ]
    },
    "context": {
      "type": "array",
      "items": {
        "type": "object",
        "additionalProperties": false,
        "required": [
          "ref",
          "origin",
          "layer",
          "text"
        ],
        "properties": {
          "ref": {
            "type": "string",
            "pattern": "^(evt|mem)_[A-Za-z0-9]{8,40}$"
          },
          "origin": {
            "enum": [
              "observation",
              "model_knowledge",
              "stated_by_other",
              "own_hypothesis",
              "imagination",
              "simulation_event",
              "model_explanation"
            ]
          },
          "layer": {
            "enum": [
              "personal",
              "interpretation",
              "state"
            ]
          },
          "text": {
            "type": "string"
          }
        }
      }
    },
    "allowed_proposals": {
      "type": "array",
      "minItems": 1,
      "uniqueItems": true,
      "items": {
        "enum": [
          "action",
          "message",
          "state_change",
          "memory_write",
          "intention",
          "creator_request",
          "no_action"
        ]
      }
    },
    "allowed_actions": {
      "type": "array",
      "items": {
        "type": "string",
        "pattern": "^cap_[A-Za-z0-9]{8,40}$"
      }
    },
    "limits": {
      "type": "object",
      "additionalProperties": false,
      "required": [
        "max_output_tokens",
        "deadline_ms",
        "attempt"
      ],
      "properties": {
        "max_output_tokens": {
          "type": "integer",
          "minimum": 1
        },
        "deadline_ms": {
          "type": "integer",
          "minimum": 1
        },
        "attempt": {
          "enum": [
            0,
            1
          ]
        }
      }
    },
    "response_schema": {
      "const": "response.schema.json"
    },
    "idempotency_key": {
      "type": "string",
      "pattern": "^req:req_[A-Za-z0-9]{8,40}$"
    }
  }
}
