{
  "request_id": "req_00000001",
  "persona_id": "per_Aurora0001",
  "session_id": "ses_00000001",
  "state_version": 7,
  "issued_at": "2026-10-11T18:00:00Z",
  "life_time_ms": 4200,
  "purpose": "choose_action",
  "context": [
    {
      "ref": "mem_00000001",
      "origin": "observation",
      "layer": "personal",
      "text": "Оператор сообщил, что вернётся вечером."
    }
  ],
  "allowed_proposals": [
    "message",
    "no_action"
  ],
  "allowed_actions": [
    "cap_00000001"
  ],
  "limits": {
    "max_output_tokens": 800,
    "deadline_ms": 60000,
    "attempt": 0
  },
  "response_schema": "response.schema.json",
  "idempotency_key": "req:req_00000001"
}
